id,question
486,"Какой штраф наложен на должностных лиц за нарушение правил ввоза и транспортировки вакцин, если это повлекло легкий вред здоровью?"
486,"Какие санкции предусмотрены за производство и реализацию незарегистрированных лекарственных средств, если они не привели к вреду здоровью?"
486,"Каковы размеры штрафов за действия, повлекшие вред здоровью человека, если они не содержат признаков уголовно наказуемого деяния?"
487,Какой штраф предусмотрен за нарушение требований технической укрепленности объектов и помещений в сфере оборота наркотиков для должностных лиц?
487,Сколько составляет штраф для субъектов среднего предпринимательства за нарушение вышеуказанных требований?
487,Каковы последствия повторного нарушения технической укрепленности в течение года после административного взыскания?
487,Какой штраф несут крупные предприниматели за повторное нарушение технической укрепленности?
487,Что может произойти с юридическим лицом в случае повторного нарушения в течение года?
488,Какое наказание предусмотрено за распространение недостоверной рекламы медицинских услуг без лицензии?
488,Каково максимальное штрафное взыскание для должностных лиц за недостоверную рекламу в области здравоохранения?
488,Какое наказание предусмотрено для субъектов малого предпринимательства за рекламу биологически активных добавок без государственной регистрации?
488,"Что произойдет, если реклама медицинских услуг не содержит признаков уголовно наказуемого деяния?"
488,Какие изменения были внесены в заголовок статьи 429 в соответствии с последними законами?
489,"Какой штраф предусмотрен за уклонение от медицинского обследования после предупреждения учреждения здравоохранения для лиц, контактировавших с ВИЧ-инфицированными?"
489,"Какова сумма штрафа за уклонение от лечения лиц, имеющих психические и поведенческие расстройства, связанные с употреблением психоактивных веществ?"
489,Что подразумевается под уклонением от медицинского обследования в контексте статьи 429?
489,"Какие заболевания упоминаются в статье 429, после контакта с которыми предусмотрены штрафы за уклонение от обследования?"
489,Какое законодательство изменило части первой и второй статьи 429?
490,Какова ответственность за уклонение от лечения лиц с опасными заболеваниями?
490,Какой штраф предусмотрен за отказ от приема лекарств после предупреждения?
490,"Кто определяет перечень заболеваний, представляющих опасность для окружающих?"
490,"Какое наказание ждет родителей, уклоняющихся от лечения несовершеннолетних с опасными заболеваниями?"
490,Какова сумма штрафа для физических лиц за уклонение от лечения несовершеннолетних?
491,Каковы последствия сокрытия источника заражения лицами с опасными заболеваниями?
491,Какой размер штрафа предусмотрен за сокрытие контактов с зараженными?
491,Что считается сокрытием источника заражения по статье 431?
491,Кто несет ответственность за сокрытие информации о заражении?
491,"Что произойдет, если лицо с заболеванием скроет контактные данные?"
492,Какое наказание предусмотрено за предоставление ложных сведений при получении разрешительных документов на медицинскую деятельность?
492,Каков размер штрафа для физических лиц за предоставление заведомо ложных сведений?
492,"Какой штраф применяется к субъектам малого предпринимательства, если они повторно предоставили ложные сведения в течение года?"
492,Какова шкала штрафов для крупных предпринимателей за предоставление ложных сведений впервые?
492,"Что произойдет, если жалоба на предоставление ложных сведений будет подана повторно в течение года после первого нарушения?"
493,Какое наказание предусмотрено за нарушение субъектами здравоохранения обязанностей по информированию уполномоченных органов?
493,Что необходимо сообщить государственному органу в сфере санитарно-эпидемиологического благополучия населения?
493,Каковы последствия повторного нарушения в течение года после административного взыскания?
493,Какое штрафное взыскание грозит должностным лицам за нарушение информирования?
493,Какие случаи медицинских событий должны быть сообщены органам внутренних дел?
494,Какое наказание предусмотрено за мелкое хулиганство согласно статье 434?
494,Что относится к мелкому хулиганству в соответствии с частью 1 статьи 434?
494,Какое наказание предусмотрено за повторное мелкое хулиганство в течение года?
494,Сколько суток может длиться административный арест за мелкое хулиганство?
494,"Что произойдет, если мелкое хулиганство будет совершено лицом, к которому не применяется административный арест?"
495,"Каковы нарушения правил поведения на спортивных мероприятиях, которые могут привести к штрафу для физических лиц?"
495,Какой размер штрафа предусмотрен за первое нарушение правил поведения на спортивных мероприятиях?
495,"Что произойдёт, если нарушение правил поведения на мероприятии будет совершено повторно в течение года?"
495,Какие предметы запрещено проносить на спортивные и массовые мероприятия согласно статье 434-1?
495,"Какова ответственность за использование визуальных предметов, направленных на разжигание розни на спортивных мероприятиях?"
496,"Какой штраф предусмотрен за загрязнение мест общего пользования, парков и скверов?"
496,Каковы последствия повторного загрязнения мест общего пользования в течение года?
496,Что понимается под загрязнением мест общего пользования согласно статье 434-2?
496,Какой размер штрафа за выброс коммунальных отходов в неустановленных местах?
496,"Что произойдет, если лицо снова загрязнит общественное пространство после административного взыскания?"
497,"Какое наказание предусмотрено за мелкое хулиганство, совершенное несовершеннолетним в возрасте от 14 до 16 лет?"
497,"Какова сумма штрафа для родителей несовершеннолетнего, совершившего хулиганство?"
497,Согласно какой статье Уголовного кодекса нарушается закон в случае мелкого хулиганства?
497,Когда были внесены изменения в закон по статье 436?
497,Что представляет собой мелкое хулиганство согласно статье 435?
498,"Какой штраф предусмотрен за применение пиротехнических изделий в населенных пунктах, если это действие нарушает покой граждан?"
498,"Какие последствия ожидают родителей за правонарушение, совершенное несовершеннолетним при использовании пиротехнических изделий?"
498,Какой штраф будет наложен за повторное нарушение в течение года после наложения административного взыскания?
498,Когда и с каким законом были внесены изменения в статью 436 относительно пиротехнических изделий?
498,"Какие действия связанные с пиротехническими изделиями подпадают под штраф и конфискацию, если не причинен крупный материальный ущерб?"
499,Каковы временные рамки для определения нарушения тишины согласно статье 437?
499,Какой штраф налагается на физических лиц за нарушение тишины в будние дни?
499,Какие меры предусмотрены в случае повторного нарушения тишины в течение года?
499,Какой размер штрафа предусмотрен для субъектов среднего предпринимательства за нарушение тишины?
499,Каковы правовые последствия нарушения тишины со стороны развлекательных заведений в жилых зонах?
500,Какой штраф предусмотрен за заведомо ложный вызов специальных служб для физических лиц?
500,"Какой размер штрафа будет, если заведомо ложный вызов совершён повторно в течение года после наложения административного взыскания?"
500,"Какой штраф предусмотрен для родителей, если заведомо ложный вызов совершает несовершеннолетний в возрасте от четырнадцати до шестнадцати лет?"
500,"Можно ли получить предупреждение вместо штрафа за заведомо ложный вызов, если его совершает несовершеннолетний?"
500,Какой штраф предусмотрен за заведомо ложный вызов в период ликвидации аварии или стихийных бедствий?
501,Каковы последствия сообщения заведомо ложной информации о факте коррупционного правонарушения?
501,Какой штраф предусмотрен за первое нарушение по статье 439?
501,"Что происходит, если заведомо ложная информация о коррупции сообщается повторно в течение года?"
501,Какой размер штрафа для физических лиц за повторное нарушение статьи 439?
501,"В какой редакции изложена статья 440, упомянутая в статье 439?"
502,Какой штраф устанавливается за распитие алкогольных напитков в общественных местах?
502,Какое административное наказание предусмотрено за появление в общественных местах в состоянии опьянения несовершеннолетних?
502,Что произойдёт в случае повторного нарушения статьи 440 в течение года?
502,На какие места не распространяется запрет на распитие алкогольных напитков?
502,"Кто отвечает за штраф, если несовершеннолетние распивают алкогольные напитки?"
503,Какой штраф предусмотрен за потребление табачных изделий в запрещенных местах согласно статье 441?
503,Какой штраф налагается за курение табачных изделий на борту воздушного судна?
503,Каково наказание за повторное нарушение запрета на потребление табачных изделий в течение года?
503,"Какие меры должен принять работодатель к лицам, потребляющим табачные изделия в не определенных местах?"
503,Какова величина штрафа для субъектов малого предпринимательства за непринятие мер против потребляющих табак?
504,Какой штраф предусмотрен за потребление табачных изделий в автомобиле с несовершеннолетними?
504,"Какой размер штрафа будет, если нарушение повторится в течение года после первого взыскания?"
504,"Что включают в себя табачные изделия, на которые распространяется данное правило?"
504,Какой закон регулирует запрет на потребление табачных изделий в автомобилях?
504,"Можно ли получить административное взыскание за курение в автомобиле, если в нем находятся дети?"
505,Какой штраф предусмотрен для законных представителей за нахождение несовершеннолетних в развлекательных заведениях без их сопровождения в ночное время?
505,С какого времени начинается ответственность за нахождение несовершеннолетних вне жилища без законных представителей?
505,Какое наказание грозит законным представителям при повторном нарушении в течение года?
505,В какое время несовершеннолетние могут находиться вне жилища без сопровождения законных представителей без штрафа?
505,"Каковы изменения, внесенные в статью 442 в соответствии с законами РК от 29.12.14 и 28.12.17?"
506,"Какое наказание предусмотрено за неповиновение законному требованию лица, обеспечивающего общественный порядок?"
506,Какой штраф будет наложен за повторное неповиновение в течение года после административного взыскания?
506,На какой срок может быть назначен административный арест за повторное неповиновение?
506,"Когда вступила в действие статья 443, согласно изменениям Закона РК?"
506,Какой размер штрафа за повторное неповиновение составляет десять месячных расчетных показателей?
507,"Каковы последствия для иностранцев, которые отказываются от обязательной дактилоскопической регистрации в соответствии с статьей 443-1?"
507,Какая ответственность предусмотрена за отказ граждан Республики Казахстан от прохождения геномной регистрации?
507,"Что произойдет с гражданами и иностранцами, если они откажутся от обязательной дактилоскопической регистрации?"
507,"Когда вступают в силу изменения в статью 444, связанные с обязательной регистрацией согласно статьe 443-1?"
507,Какой штраф установлен за отказ от прохождения геномной регистрации согласно статье 443-1?
508,Каковы последствия участия в азартных играх в неотведенных для этого местах?
508,Какой размер штрафа предусмотрен за принятие ставок на спортивные состязания без специального разрешения?
508,Какие меры предусмотрены за вовлечение граждан до 21 года в азартные игры?
508,Что происходит с игральными принадлежностями при наложении штрафа?
508,Какие изменения были внесены в статью 444 согласно последним законам?
509,Какое наказание предусмотрено за несоблюдение требований о расположении игорных заведений в нежилых помещениях?
509,Что грозит организатору игорного бизнеса за заключение пари вне игорных заведений?
509,Какие штрафы устанавливаются за невыполнение условий по формированию обязательных резервов?
509,Какое взыскание предусмотрено за монтаж игровых автоматов в неположенных местах?
509,Каков размер штрафа за использование игровых автоматов с нарушением технических требований?
510,Каковы штрафы для операторов лотереи за невыполнение требований об опубликовании результатов тиражей?
510,Что грозит оператору лотереи за нарушение сроков направления условий проведения лотереи в уполномоченный орган?
510,Какой штраф применяется в случае несвоевременного предоставления информации о распространенных лотерейных билетах?
510,Каковы последствия для оператора лотереи за нарушение требований по формированию призового фонда?
510,"Каковы штрафы для физических лиц, которые проведут лотерею без статуса оператора?"
511,Что такое продукция эротического содержания в контексте Статьи 446?
511,"Какие последствия ждут за продажу эротической продукции в местах, не предназначенных для этого?"
511,Какой размер штрафа предусмотрен для физических лиц за рекламирование эротической продукции?
511,Когда наступает конфискация продукции эротического содержания?
511,Какие места считаются отведенными для рекламирования продукции эротического содержания?
512,Какой размер штрафа предусмотрен для физических лиц за нарушение правил охраны памятников?
512,"С какого числа вступили в силу изменения, внесенные в статью 448?"
512,Какой размер штрафа предусмотрен для должностных лиц за нарушение правил использования исторических памятников?
512,Что будет являться нарушением правил охраны памятников культуры?
512,Какие памятники охраняются государством в соответствии с данной статьей?
513,Какие действия считаются вандализмом несовершеннолетних согласно статье 448?
513,"Каковы последствия вандализма, совершенного несовершеннолетними до шестнадцати лет?"
513,Кто несет ответственность за вандализм несовершеннолетних по статье 448?
513,Какой штраф предусмотрен для родителей несовершеннолетних за вандализм?
513,"С какого времени вступают в силу изменения, упомянутые в статье 448?"
514,Какие действия считаются приставанием в общественных местах согласно статье 449?
514,"Какое наказание предусмотрено за первое приставание для лица, не являющегося субъектом предпринимательства?"
514,"Что произойдет, если приставание будет совершено повторно в течение года после наложения штрафа?"
514,"Какое наказание может понести иностранец за приставание, согласно части третьей статьи 449?"
514,"Когда вступит в силу новая редакция статьи 450, которая касается приставания?"
