id,question
175,Какой штраф накладывается на крупные предприятия за повторное нарушение в течение года?
175,"Что произойдет, если субъект естественной монополии не предоставит документы в уполномоченный орган в установленный срок?"
175,"Какой штраф предусмотрен за несоблюдение обязанностей, установленных законодательством о естественных монополиях?"
175,"В каком размере штраф будет наложен на юридических лиц за действия, повлекшие получение дохода от административного правонарушения?"
176,"Каковы основные изменения, внесенные в статью 165 относительно продажи электрической энергии с 1 апреля 2023 года?"
176,"Какой штраф предусмотрен для юридических лиц за нарушение порядка реализации электрической энергии, превышающей отпускную цену?"
176,Что считается административным правонарушением для энергопроизводящих организаций при продаже электрической энергии физическим и юридическим лицам?
176,Какой штраф налагается на юридических лиц за незаконное приобретение электрической энергии у другой энергопроизводящей организации?
176,"Как определяется сумма дохода (выручки), полученного в результате административного правонарушения, согласно статье 165?"
177,Каковы последствия за непредоставление информации об отпускных ценах субъектом общественно значимого рынка?
177,Какой штраф грозит субъектам малого предпринимательства за неисполнение инвестиционной программы?
177,"Что понимается под доходом, полученным в результате административного правонарушения согласно статье 166?"
177,"Какой размер штрафа ожидает средние предприятия за возврат дохода, не использованного на реализацию инвестиционных программ?"
177,Какая процедура действия субъектов общественно значимого рынка при повышении цен и какие штрафы они могут получить?
178,Какое наказание предусмотрено за несоблюдение порядка ценообразования для субъектов малого предпринимательства?
178,Какой штраф в размере предусмотрен для субъектов среднего предпринимательства за нарушение порядка ценообразования?
178,Каковы размеры штрафов для субъектов крупного предпринимательства при несоблюдении установленных правил ценообразования?
178,"С какого числа вступают в силу изменения, внесенные в статью 168 согласно Закону РК от 08.07.24 г.?"
178,Какие изменения были внесены в статью 168 согласно Закону РК от 28.12.16 г.?
179,Каковы последствия неисполнения инвестиционной программы энергопроизводящей организацией?
179,Какой размер штрафа предусмотрен за неисполнение предписания об инвестиционной программе?
179,Кто уполномочен выдавать предписания для исполнения инвестиционной программы?
179,Как вычисляется сумма штрафа за неисполнение инвестиционной программы?
179,"Что включает в себя инвестиционная программа, требуемая к исполнению энергопроизводящей организацией?"
180,Какое наказание предусмотрено за превышение норм квоты на приобретение пищевого сырья для производства биотоплива?
180,Что происходит при повторном нарушении норм квоты в течение года?
180,Какие штрафы предусмотрены за использование пшеницы 1 и 2 классов в качестве сырья для биотоплива?
180,"Каковы последствия реализации биотоплива, который не соответствует техническим регламентам?"
180,Что грозит производителям биотоплива за отсутствие документов и контроля в процессе производства?
181,Каковы последствия за непредставление сведений о газоснабжении в установленные сроки?
181,Каков размер штрафа для субъекта крупного предпринимательства за нарушение ограничений по эксплуатации объектов газоснабжения?
181,"Что произойдет, если юридическое лицо нарушит порядок учета сжиженного газа?"
181,Какова ответственность за нарушение права государства на приобретение сырого газа?
181,Какие штрафы предусмотрены за незаконную реализацию сжиженного нефтяного газа за пределы Казахстана?
182,Какова ответственность для малого предпринимательства за превышение предельной цены розничной реализации нефтепродуктов?
182,Какой штраф налагается на субъекты среднего предпринимательства за превышение цен на сжиженный газ?
182,"Что будет, если юридическое лицо повторно нарушит правила в течение года?"
182,"Как рассчитывается доход, полученный в результате административного правонарушения согласно статье 171?"
182,Какие изменения были внесены в статью 172 согласно последним законам?
183,Каковы последствия за неопубликование или недостоверное представление данных об инвестициях энергопроизводящей организацией согласно статье 172 закона об электроэнергетике Казахстана?
183,Какой штраф полагается субъектам среднего предпринимательства за несвоевременное представление отчетов по затратам на производство электрической энергии?
183,Какие санкции предусмотрены за неисполнение инвестиционных обязательств энергопроизводящей организацией?
183,Что может грозить должностным лицам за незаконное отключение электрической или тепловой энергии согласно статье 172?
183,Каков штраф для энергоснабжающей организации за отказ заключить индивидуальный договор энергоснабжения с потребителем?
184,Какие последствия предусмотрены за незаконное вмешательство должностных лиц в предпринимательскую деятельность?
184,Что включается в понятие незаконного вмешательства в контексте статьи 173?
184,Кто конкретно может быть привлечен к ответственности за нарушение статьи 173?
184,Какова сумма штрафа за незаконное вмешательство должностных лиц в деятельность предпринимателей?
184,Обращается ли статья 173 к конкретным категориям предпринимателей или она применяется ко всем индивидуальным предпринимателям и юридическим лицам?
185,Каковы последствия подкупа участников профессиональных спортивных соревнований согласно статье 174?
185,Каков размер штрафа за повторное совершение подкупа в течение года?
185,Что считается незаконным получением средств спортсменами в контексте статьи 174?
185,Какие правонарушения в отношении спортивных судей могут повлечь аналогичные последствия?
185,Какое имущество или услуги может незаконно получать спортсмен для влияния на результаты соревнований?
186,Каковы основания для проведения проверки субъектов частного предпринимательства согласно Статье 175?
186,Какие нарушения допускаются при уведомлении о проведении проверки и профилактического контроля?
186,Какие последствия влекут нарушения порядка проведения проверки субъекта частного предпринимательства?
186,"Каковы требования к документам и информации, которые могут запрашиваться в ходе проверки?"
186,"Что произойдет, если проверка была проведена повторно в течение года после наложения административного взыскания?"
187,Каковы последствия за необоснованное проведение контроля и надзора за частными предпринимателями согласно статье 175-1?
187,Какой размер штрафа предусмотрен для должностных лиц при первом нарушении статьи 175-1?
187,"Что произойдет, если должностное лицо повторно нарушит статью 175-1 в течение года после штрафа?"
187,"С какого времени вступили в действие изменения в статью 176, касающиеся контроля и надзора?"
187,Какое количество месячных расчетных показателей составляет штраф за повторное нарушение статьи 175-1?
188,Какие действия считаются неправомерными при реабилитации и банкротстве индивидуальных предпринимателей?
188,Каковы размеры штрафов за сокрытие имущества должником в процессе банкротства?
188,"Что происходит, если индивидуальный предприниматель удовлетворяет требования кредиторов заведомо в ущерб другим кредиторам?"
188,Кто может быть подвергнут штрафу за неправомерные действия в процессе реабилитации и банкротства?
188,Каковы размеры штрафов для субъектов малого и среднего предпринимательства за нарушение статьи 176?
189,"Каковы последствия за сокрытие имущества гражданином Казахстана, не зарегистрированным как индивидуальный предприниматель, в процессе банкротства?"
189,Какой штраф предусмотрен за неправомерное удовлетворение требований отдельных кредиторов в процессе восстановления платежеспособности?
189,Что включает в себя понятие 'неправомерные действия' при восстановлении платежеспособности согласно статье 176-1?
189,Какие действия считаются сокрытием имущества в контексте статьи 176-1?
189,Какова сумма штрафа за сокрытие имущественных обязательств в соответствии со статьей 176-1?
190,Каковы последствия за неисполнение обязанности представить в суд заключение о финансовой устойчивости должника согласно статье 177?
190,Какой штраф предусмотрен за ненадлежащее выполнение инвентаризации имущественной массы банкрота?
190,Какова ответственность временного управляющего за неуведомление кредиторов о дате собрания?
190,Что грозит за несвоевременное уведомление кредиторов о решении по их требованиям?
190,"Каковы штрафные санкции при повторном нарушении обязанностей, предусмотренных статьёй 177?"
191,"Какой штраф предусмотрен за нарушение установленного порядка проведения публичных торгов, аукционов или конкурсов?"
191,Что считается крупным ущербом согласно статье 178?
191,На какую сумму должен составлять ущерб для его признания крупным физическому лицу?
191,Какой размер ущерба признан крупным для организаций или государства?
191,Какие действия приводят к штрафу по статье 178?
192,Какое наказание предусмотрено за неисполнение обязанности по проведению инвентаризации и представлению отчета по ней комитету кредиторов?
192,Какой штраф налагается на банкротного управляющего за ненадлежащую охрану имущества банкрота?
192,Что грозит управляющему за непредставление текущей информации о ходе процедуры банкротства уполномоченному органу?
192,Какое административное взыскание предусмотрено за несвоевременное уведомление кредиторов о заседаниях собраний?
192,Каковы последствия за повторное нарушение требований законодательства о реабилитации и банкротстве в течение года?
193,Какое штрафное наказание предусмотрено за неисполнение обязанности направить объявление о возбуждении производства по делу о реабилитации?
193,Каковы последствия за нарушение порядка формирования реестра требований кредиторов согласно 법у?
193,Какой штраф применяется за ненадлежащее исполнение обязанности представить заключение о финансовой устойчивости должника?
193,Какие штрафные санкции предусмотрены за неуведомление кредиторов о месте и дате первого собрания?
193,"Что произойдет, если действия, предусмотренные статьей, будут совершены повторно в течение года после административного взыскания?"
194,Какой штраф установлен за неисполнение обязанностей по принятию имущества должника в управление?
194,Что происходит в случае ненадлежащего исполнения плана реабилитации?
194,Какие действия влекут предупреждение в реабилитационной процедуре?
194,Какой штраф предусмотрен за необеспечение уведомления кредиторов о собрании?
194,Каковы последствия повторного нарушения обязанностей в течение года после штрафа?
195,Каковы последствия для финансового управляющего за ненадлежащее исполнение обязанностей по объявлению о возбуждении производства по делу о банкротстве?
195,Какая ответственность предусмотрена за неисполнение финансовым управляющим обязанностей по проведению инвентаризации имущества должника?
195,"Что произойдет, если финансовый управляющий не предоставит своевременно заключения в суд?"
195,Какая мера применима за недолжное удовлетворение имущественных требований кредиторов?
195,Каковы штрафные санкции за повторное нарушение обязанностей финансовым управляющим в течение года?
196,Что такое преднамеренное банкротство согласно статье 182?
196,"Каковы действия, которые могут быть расценены как преднамеренное банкротство юридического лица?"
196,Какой штраф предусмотрен для физического лица за преднамеренное банкротство?
196,"Каков срок, в течение которого могут быть совершены действия, квалифицируемые как преднамеренное банкротство?"
196,Каковы последствия преднамеренного банкротства гражданина согласно статье 182?
197,Какой закон исключил статью 183?
197,Когда вступила в силу статья 184?
197,Какое изменение произошло в статье 184 согласно закону от 10.01.18?
197,"Какой был номер закона, который исключил статью 183?"
197,Когда была введена в действие статья 184?
198,Какие санкции применяются за несвоевременное предоставление информации в оценочной деятельности?
198,"Какой штраф предусмотрен за неустранение нарушений, выявленных в ходе проверки оценочной деятельности?"
198,Что грозит за повторные нарушения в течение года после административного взыскания?
198,Какой размер штрафа составляет двадцать месячных расчетных показателей?
198,Какие изменения были внесены в статью 185 в соответствии с последним законом?
199,Какое наказание предусмотрено за нарушение обязанности сохранения коммерческой тайны?
199,Какой штраф может быть назначен за утечку сведений кредитных отчетов?
199,"Кто несет ответственность за разглашение банковской тайны, полученной в результате профессиональной деятельности?"
199,При выполнении каких обстоятельств ответственность за нарушение этих норм отсутствует?
199,Какова сумма штрафа в случае нарушения хранения информации из базы данных кредитных историй?
200,"Что будет, если нарушить обязанность по сохранению тайны страхования?"
200,Какой размер штрафа за несохранение тайны пенсионных накоплений?
200,Кто может быть оштрафован за нарушение статьи 186?
200,Нужен ли согласие владельца для раскрытия сведений о микрокредитах?
200,В каком случае применяется штраф в размере пятидесяти месячных расчетных показателей?
201,Какое наказание предусмотрено за непредставление информации туристам о рисках путешествий?
201,Какой штраф накладывается на туристическую компанию за отсутствие письменного договора на туристское обслуживание?
201,Какие последствия ожидают туристическую компанию за повторные нарушения в течение года?
201,Какой штраф предусмотрен за несвоевременное предоставление информации о чрезвычайных происшествиях туристов?
201,"Что произойдет, если нарушение, предусмотренное частью четвертой, будет совершено повторно в течение года?"
202,Какова история статьи 188 в соответствии с Законом РК от 28.12.17 г. № 127-VI?
202,Что означает исключение статьи 188 для правовой системы Казахстана?
202,Какие последствия имеет исключение статьи 188 для юридических лиц?
202,Есть ли преемственность в содержании старой версии статьи 188?
202,Где можно найти информацию о предыдущих редакциях статьи 188?
203,Какова основная информация по статье 189?
203,"Когда вступил в действие закон, исключивший статью 189?"
203,Какой закон стал причиной исключения статьи 189?
203,Что произошло со статьей 189 согласно последним изменениям?
203,Какие изменения были внесены в закон о статье 189 в 2021 году?
