id,question
342,Какой максимальный штраф может быть наложен на крупное предпринимательство за ненадлежащее исполнение обязанностей в области возобновляемых источников энергии?
342,Что включает в себя нарушение законодательства в области поддержки использования возобновляемых источников энергии в Казахстане?
343,"Какое наказание предусмотрено за повреждение тепловых сетей, если не было угрозы для здоровья людей?"
343,Какой размер штрафа для физических лиц за повреждение тепловых сетей?
343,Какой штраф должен заплатить субъект малого предпринимательства за указанное нарушение?
343,Какой максимальный штраф предусмотрен для крупных предприятий за повреждение тепловых сетей?
343,Как изменения в статью 305 связаны с законом от 11.07.17 г. № 89-VI?
344,Каковы последствия за производство работ в охранных зонах линий электрических и тепловых сетей без согласования?
344,"Какой штраф установлен для физических лиц за нарушения, связанные с охранными зонами объектов систем газоснабжения?"
344,Какой размер штрафа для субъектов малого предпринимательства за работы в охранных зонах?
344,"Что включают в себя работы, запрещенные в охранных зонах линий электрических и тепловых сетей?"
344,Какой штраф предусмотрен для крупных предпринимателей за нарушения в охранных зонах?
345,Какой штраф предусмотрен за нарушение требований по безопасности эксплуатации газопотребляющих систем физическими лицами?
345,Какой размер штрафа на субъекты малого предпринимательства за повторное нарушение требований по безопасности использования газа в течение года?
345,Какое наказание предусмотрено за самовольное возобновление подачи газов для физических лиц?
345,Какой штраф грозит субъектам крупного предпринимательства за нарушение безопасности эксплуатации объектов систем газоснабжения?
345,Каковы размеры штрафов для субъектов среднего предпринимательства за повторные нарушения требований по безопасности эксплуатации в течение года?
346,Какие меры необходимо принять для обеспечения подготовленности резервного топливного хозяйства?
346,Каковы последствия за непринятие мер к обеспечению подготовленности резервного топливного хозяйства?
346,Какой размер штрафа предусмотрен за неподготовленность газопотребляющих систем?
346,К каким категориям потребителей относится резервное топливное хозяйство согласно статье 307?
346,Когда была изменена редакция заголовка статьи 307?
347,Какой размер штрафа предусмотрен для физических лиц за повреждение нефтепроводов и газопроводов?
347,Какие действия приводят к штрафам согласно статье 308?
347,Какой штраф грозит субъектам малого предпринимательства за повторное нарушение в течение года?
347,Какие изменения были внесены в статью 308 согласно закону РК от 28.12.17 г.?
347,Каковы размеры штрафов для субъектов крупного предпринимательства за первичное и повторное нарушение?
348,Каковы последствия за раскопку дворов без разрешения согласно статье 309?
348,Какой штраф налагается на физических лиц за повреждение территорий при строительных работах?
348,Каковы меры ответственности для субъектов малого предпринимательства за непринятие мер по приведению в порядок строительных площадок?
348,На какую сумму могут быть оштрафованы субъекты крупного предпринимательства при нарушении статьи 309?
348,С каких дат будут вводиться новые статьи 309-1 и 309-2 в главу 18?
349,Какое наказание предусмотрено за реализацию проекта в области космической деятельности без положительного заключения экспертизы?
349,Что грозит за запуск космического объекта без согласия Правительства Республики Казахстан?
349,Какие действия являются нарушениями в отношении государственной регистрации космического объекта?
349,Какое финансовое наказание ожидает физических лиц за создание угрозы жизни и здоровью людей при космической деятельности?
349,Каковы последствия за повторные нарушения законодательства в области космической деятельности в течение года?
350,Каковы штрафы для физических лиц за нарушение правил создания и эксплуатации космических систем в Казахстане?
350,"Что произойдет, если организация не устранит нарушения после истечения срока приостановления действия лицензии?"
350,Какой максимальный размер штрафа может быть назначен субъектам крупного предпринимательства за эксплуатацию космической системы?
350,"Какие последствия могут возникнуть для персонажа, если его космическая система превышает допустимые значения воздействия на окружающую среду?"
350,На сколько месяцев может быть приостановлена лицензия на использование космического пространства за нарушения?
351,Каковы штрафы за выполнение строительных работ с нарушением законодательства Республики Казахстан согласно статье 312?
351,Какой размер штрафа на должностных лиц при нарушении требований законодательства в сфере строительства?
351,Какое наказание предусмотрено за повторные нарушения в течение года по статье 312?
351,Что происходит с субъектами малого предпринимательства при многократных нарушениях требований в сфере архитектурной деятельности?
351,Каковы штрафы для крупных предпринимателей за строительство с нарушением государственных нормативов в сфере градостроительства?
352,Что произойдет в случае нарушения строительных норм и проектных документов при проведении строительных работ?
352,"Каковы размеры штрафов для различных субъектов предпринимательства за нарушения, указанные в статье 313?"
352,Какие последствия предусмотрены в случае потери прочности или устойчивости зданий?
352,Как изменились требования к штрафам с введением Закона РК от 05.10.18 г. № 184-VI?
352,Какова ответственность должностных лиц за нарушение строительных норм согласно статье 313?
353,"Каковы последствия для должностных лиц, если строительные работы выполнялись без утвержденной проектной документации?"
353,Какой штраф предусмотрен для субъектов малого предпринимательства за нарушения в строительстве?
353,"Что произойдет, если аналогичное правонарушение будет совершено повторно в течение года?"
353,Какой штраф назначается для субъектов крупного предпринимательства в случае повторных нарушений?
353,Какие требования исключаются из данной статьи при проведении строительных работ?
354,Каковы последствия нарушения правил оформления исполнительной технической документации согласно статье 315?
354,"Какие штрафы предусмотрены для должностных лиц за нарушение требований, указанных в статье 315?"
354,Сколько составляет штраф для субъектов малого предпринимательства за нарушение правил оформления исполнительной технической документации?
354,Какие категории предприятий упоминаются в статье 315 и какие штрафы для них предусмотрены?
354,Когда вступили в силу изменения в заголовок статьи 316 согласно статье 315?
355,Какие действия в области строительства могут привести к штрафам согласно статье 316?
355,Каковы размеры штрафов для физических и должностных лиц за нарушение статьи 316?
355,"Что произойдет, если нарушение статьи 316 будет повторено в течение года после наложения штрафа?"
355,В каких случаях можно избежать штрафов при строительстве по статье 316?
355,Какой закон внес изменения в часть 1 статьи 316 и когда они вступили в силу?
356,"Какие последствия наступают для лиц, осуществляющих авторский надзор, в случае выявления несоответствий в выполненных строительно-монтажных работах?"
356,"Какой штраф предусмотрен для экспертов, которые выдали положительное заключение на проектную документацию, не соответствующую законодательству Республики Казахстан?"
356,"Что грозит техническим надзорам за нарушения качества, сроков или приемки выполненных работ на стадии реализации проекта?"
356,Какие меры ответственности предусмотрены за выдачу недостоверных данных при техническом обследовании зданий и сооружений?
356,"Каково наказание за повторные нарушения, совершенные в течение года после наложения административного взыскания?"
357,Какие виды инжиниринговых услуг и экспертных работ регулируются статьей 317-1?
357,"Что произойдет, если аккредитованное юридическое лицо нарушит законодательство при осуществлении инжиниринговых услуг?"
357,Каковы штрафы для юридических лиц за несоответствие квалификационным требованиям?
357,"Какие конкретные нарушения прописаны в статье 317-1, касающиеся проектной документации?"
357,"Что произойдет, если нарушения будут зафиксированы повторно в течение года?"
358,Каковы штрафы для юридических лиц за аттестацию инженерно-технических работников с нарушением законодательства Республики Казахстан?
358,Что происходит при повторном нарушении аттестации в течение года после административного взыскания?
358,Каковы размеры штрафов за первичное и повторное нарушение в области аттестации инженерно-технических работников?
358,Какой закон регулирует аттестацию инженерно-технических работников в Казахстане?
358,Что ожидает юридическое лицо при лишении свидетельства об аккредитации?
359,Какое наказание предусмотрено для физических лиц за нарушение порядка приемки объектов в эксплуатацию?
359,Сколько составит штраф для субъектов среднего предпринимательства при нарушении установленного порядка приемки?
359,Что охватывает статья 318 главы 20 в контексте архитектурно-строительной деятельности?
359,Какой размер штрафа установлен для должностных лиц за нарушение требований при вводе объектов в эксплуатацию?
359,Какие организации подпадают под штраф в размере ста двадцати месячных расчетных показателей?
360,Какой штраф предусмотрен для физических лиц за незаконное строительство?
360,Какой размер штрафа налагается на малый бизнес за незаконное строительство?
360,Какой штраф должен уплатить субъект среднего предпринимательства за незаконное строительство?
360,Какие последствия могут ожидать должностные лица за строительство без права на землю?
360,Что может быть сделано с незаконно возведённым строением согласно статье 319?
361,Какое административное наказание предусмотрено за нарушение требований законодательства о долевом участии в жилищном строительстве застройщиком?
361,Каков размер штрафа для юридических лиц за непредставление информации местным исполнительным органам?
361,Что происходит при повторном нарушении требований в течение года после наложения административного взыскания?
361,Какие последствия влекут нарушения сроков открытия текущих счетов на объект кондоминиума?
361,Какой штраф применяется за повторное нарушение сроков представления отчетов управляющим многоквартирным домом?
362,Какие штрафы предусмотрены за осуществление строительства без технического и авторского надзора?
362,Какой размер штрафа для физических лиц за строительство без надзора?
362,Какова ответственность для субъектов малого предпринимательства за нарушение статьи 321?
362,С какого года вступили в силу изменения заголовка статьи 322?
362,Каково максимальное наказание для субъектов крупного предпринимательства за строительство без надзора?
363,Какой штраф предусмотрен за незаконные переоборудование и перепланировку жилых и нежилых помещений без соответствующего проекта?
363,"Какой размер штрафа будет наложен на должностных лиц за действия, повлекшие полную потерю прочности здания?"
363,Что подразумевается под административным правонарушением в области строительства согласно статье 322?
363,"Какие последствия влекут действия, которые могут привести к разрушению здания?"
363,"Какое определение дается понятиям прочности, устойчивости и надежности в контексте данной статьи?"
364,Какие объекты подлежат штрафам за эксплуатацию без введения в эксплуатацию?
364,Какой размер штрафа для физических лиц за эксплуатацию не введенных объектов?
364,Каковы последствия для субъектов малого предпринимательства за использование не введенных в эксплуатацию комплексов?
364,"С какого времени вступили в силу изменения, внесенные в статью 323?"
364,Что предусмотрено для субъектов крупного предпринимательства за эксплуатацию объектов без надлежащего оформления?
365,Каковы штрафы для должностных лиц за нарушение законодательства в сфере градостроительной деятельности?
365,Что подразумевается под ненадлежащим выполнением требований местных исполнительных органов?
365,Какова сумма штрафа за повторное нарушение в течение года после предыдущего административного взыскания?
365,К каким требованиям не применяются установленные технические регламенты в контексте статьи 323-1?
365,Какое законодательство регулирует действия местных исполнительных органов в области архитектуры и градостроительства?
366,Каковы штрафы за нарушение санитарно-эпидемиологических и экологических требований согласно статье 324?
366,Какие изменения в части 1 статьи 324 были внесены согласно Закону РК от 02.01.21 г.?
366,Какое наказание предусмотрено за дачу указаний на превышение норм санитарных требований?
366,Кто несет ответственность за нарушения норм охраны окружающей среды в соответствии с статьей 324?
366,С какого числа вступили в силу изменения в статье 324?
367,Каков размер штрафа для физических лиц за нарушение требований экологического контроля?
367,Какой штраф предусмотрен для должностных лиц и субъектов малого предпринимательства?
367,Каков размер штрафа для субъектов среднего предпринимательства?
367,Какой штраф полагается субъектам крупного предпринимательства за нарушение экологических норм?
367,С какой даты вступило в силу изменение в статью 326?
368,Какой штраф предусмотрен для должностных лиц за невыполнение условий экологического разрешения?
368,Какой штраф налагается на субъекты крупного предпринимательства за повторное нарушение условий экологического разрешения в течение трех лет?
368,"Что происходит, если действие экологического разрешения приостановлено и нарушения не устранены в установленный срок?"
368,"Какой размер штрафа за нарушение условий экологического разрешения, сопряженный с экологическим ущербом для субъектов среднего предпринимательства?"
368,"Какова ответственность за нарушения условий экологического разрешения, если за отдельное нарушение не предусмотрена ответственность в других статьях?"
369,Какова история изменения статьи 327 в Глава 21?
369,"Когда вступили в силу изменения, касающиеся статьи 327?"
369,Какое новое положение введено вместо статьи 327?
369,Что подразумевает закон РК от 02.01.21 г. № 403-VI?
369,Когда была добавлена статья 327-1 в Глава 21?
370,Каковы штрафы за непредставление обязательных сведений по экологическому законодательству в Казахстане?
370,Каковы последствия повторного нарушения требований по представлению обязательных сведений в течение года?
